{
  "manifest_schema_version": "1.0.0",
  "session_id": "sess_org_b",
  "scenario_id": "scn_org_b",
  "pool": "organizer",
  "camera_ids": [
    "cam_orgB"
  ],
  "footage_files": [
    {
      "file_id": "sess_org_b_v1",
      "camera_id": "cam_orgB",
      "logical_path": "footage/sess_org_b/sess_org_b_v1.mp4",
      "source_sha256": "f3f241dd4568bf1bda0272c168eca14a81fdca64bcdc3d3823c47c6d5c4c85d9",
      "duration_s": 600.0,
      "codec": "h264",
      "container": "mp4",
      "declared_fps": 25.0,
      "recording_start": null,
      "timebase": "1/25",
      "synthetic": true
    }
  ],
  "authorization": {
    "status": "pending",
    "consent_recorded": false,
    "retention_policy": "per-organizer-agreement",
    "notes": "SYNTHETIC placeholder; real organizer footage pending (§21.2)."
  },
  "provenance": {
    "collected_by": "member4-seed-generator",
    "collection_date": "2026-07-20",
    "staged_scenario_description": "",
    "organizer_delivery_ref": "PENDING"
  },
  "synthetic": true,
  "notes": "Deterministic synthetic manifest generated by data/tools/build_seed_dataset.py.",
  "created_at": "2026-07-20T09:00:00",
  "content_hash": "ebdad14b2f328f273c329b5c742cb8d8a96b9bc0cf0de579af0066476ce1ffd5"
}
