{
  "manifest_schema_version": "1.0.0",
  "session_id": "sess_court",
  "scenario_id": "scn_court",
  "pool": "staged",
  "camera_ids": [
    "cam_court"
  ],
  "footage_files": [
    {
      "file_id": "sess_court_v1",
      "camera_id": "cam_court",
      "logical_path": "footage/sess_court/sess_court_v1.mp4",
      "source_sha256": "549cee34050caf09ecc72087bf50c1e94bf9403c236e3755e6ab267f475bf60e",
      "duration_s": 480.0,
      "codec": "h264",
      "container": "mp4",
      "declared_fps": 25.0,
      "recording_start": null,
      "timebase": "1/25",
      "synthetic": true
    }
  ],
  "authorization": {
    "status": "authorized",
    "consent_recorded": true,
    "retention_policy": "delete-after-event",
    "notes": "SYNTHETIC placeholder session."
  },
  "provenance": {
    "collected_by": "member4-seed-generator",
    "collection_date": "2026-07-20",
    "staged_scenario_description": "synthetic staged scenario for scn_court",
    "organizer_delivery_ref": null
  },
  "synthetic": true,
  "notes": "Deterministic synthetic manifest generated by data/tools/build_seed_dataset.py.",
  "created_at": "2026-07-20T09:00:00",
  "content_hash": "3310633cd40e014514b2f0eed6e71fb377dc88d3f97f77cf5683d289ae3f1521"
}
