{
  "manifest_schema_version": "1.0.0",
  "session_id": "sess_lobby",
  "scenario_id": "scn_lobby",
  "pool": "staged",
  "camera_ids": [
    "cam_lobby"
  ],
  "footage_files": [
    {
      "file_id": "sess_lobby_v1",
      "camera_id": "cam_lobby",
      "logical_path": "footage/sess_lobby/sess_lobby_v1.mp4",
      "source_sha256": "88b75b7b57dec5c7750c29dea823bd6bc205f731b96f3980c7a3203303f0fdd3",
      "duration_s": 600.0,
      "codec": "h264",
      "container": "mp4",
      "declared_fps": 25.0,
      "recording_start": null,
      "timebase": "1/25",
      "synthetic": true
    }
  ],
  "authorization": {
    "status": "authorized",
    "consent_recorded": true,
    "retention_policy": "delete-after-event",
    "notes": "SYNTHETIC placeholder session."
  },
  "provenance": {
    "collected_by": "member4-seed-generator",
    "collection_date": "2026-07-20",
    "staged_scenario_description": "synthetic staged scenario for scn_lobby",
    "organizer_delivery_ref": null
  },
  "synthetic": true,
  "notes": "Deterministic synthetic manifest generated by data/tools/build_seed_dataset.py.",
  "created_at": "2026-07-20T09:00:00",
  "content_hash": "c1baec7f24ccfa73d0b716e1993b86e856dc0f76e6fbe05eb10922ee8cf57418"
}
