{
  "manifest_schema_version": "1.0.0",
  "session_id": "sess_dark",
  "scenario_id": "scn_dark",
  "pool": "staged",
  "camera_ids": [
    "cam_dark"
  ],
  "footage_files": [
    {
      "file_id": "sess_dark_v1",
      "camera_id": "cam_dark",
      "logical_path": "footage/sess_dark/sess_dark_v1.mp4",
      "source_sha256": "16291a4171c1c8fb7cc2823dabc7eb9797967b187ceb05f07ab0996d0237f41a",
      "duration_s": 360.0,
      "codec": "h264",
      "container": "mp4",
      "declared_fps": 25.0,
      "recording_start": null,
      "timebase": "1/25",
      "synthetic": true
    }
  ],
  "authorization": {
    "status": "authorized",
    "consent_recorded": true,
    "retention_policy": "delete-after-event",
    "notes": "SYNTHETIC placeholder session."
  },
  "provenance": {
    "collected_by": "member4-seed-generator",
    "collection_date": "2026-07-20",
    "staged_scenario_description": "synthetic staged scenario for scn_dark",
    "organizer_delivery_ref": null
  },
  "synthetic": true,
  "notes": "Deterministic synthetic manifest generated by data/tools/build_seed_dataset.py.",
  "created_at": "2026-07-20T09:00:00",
  "content_hash": "f539387d046469780903a57c8aa8aaf11675666861a2ab242f5dbcfeb5b1d244"
}
