{
  "manifest_schema_version": "1.0.0",
  "session_id": "sess_hat",
  "scenario_id": "scn_hat",
  "pool": "staged",
  "camera_ids": [
    "cam_hat"
  ],
  "footage_files": [
    {
      "file_id": "sess_hat_v1",
      "camera_id": "cam_hat",
      "logical_path": "footage/sess_hat/sess_hat_v1.mp4",
      "source_sha256": "d163befad50e3c03fd4246377b6a6b080096f8b83a4a1b7d5d9940cb11b440b7",
      "duration_s": 360.0,
      "codec": "h264",
      "container": "mp4",
      "declared_fps": 25.0,
      "recording_start": null,
      "timebase": "1/25",
      "synthetic": true
    }
  ],
  "authorization": {
    "status": "authorized",
    "consent_recorded": true,
    "retention_policy": "delete-after-event",
    "notes": "SYNTHETIC placeholder session."
  },
  "provenance": {
    "collected_by": "member4-seed-generator",
    "collection_date": "2026-07-20",
    "staged_scenario_description": "synthetic staged scenario for scn_hat",
    "organizer_delivery_ref": null
  },
  "synthetic": true,
  "notes": "Deterministic synthetic manifest generated by data/tools/build_seed_dataset.py.",
  "created_at": "2026-07-20T09:00:00",
  "content_hash": "ac379c294175501f34bc89bffde8909887104c1ffc67430bf4da8f8dc610e98f"
}
