{
  "manifest_schema_version": "1.0.0",
  "session_id": "sess_court_b",
  "scenario_id": "scn_court_b",
  "pool": "staged",
  "camera_ids": [
    "cam_court"
  ],
  "footage_files": [
    {
      "file_id": "sess_court_b_v1",
      "camera_id": "cam_court",
      "logical_path": "footage/sess_court_b/sess_court_b_v1.mp4",
      "source_sha256": "0148ae7eb623957af7abe6d0b8187e6b6dfd0ee3ecf0ddec11ab8abe7eb74b02",
      "duration_s": 480.0,
      "codec": "h264",
      "container": "mp4",
      "declared_fps": 25.0,
      "recording_start": null,
      "timebase": "1/25",
      "synthetic": true
    }
  ],
  "authorization": {
    "status": "authorized",
    "consent_recorded": true,
    "retention_policy": "delete-after-event",
    "notes": "SYNTHETIC placeholder session."
  },
  "provenance": {
    "collected_by": "member4-seed-generator",
    "collection_date": "2026-07-20",
    "staged_scenario_description": "synthetic staged scenario for scn_court_b",
    "organizer_delivery_ref": null
  },
  "synthetic": true,
  "notes": "Deterministic synthetic manifest generated by data/tools/build_seed_dataset.py.",
  "created_at": "2026-07-20T09:00:00",
  "content_hash": "ce360e77cf5391652a5d45438cd92b6c4b8561626fef54b91cf9a5af0b966c7f"
}
