{
  "manifest_schema_version": "1.0.0",
  "session_id": "sess_corr_b",
  "scenario_id": "scn_corr_b",
  "pool": "staged",
  "camera_ids": [
    "cam_corr"
  ],
  "footage_files": [
    {
      "file_id": "sess_corr_b_v1",
      "camera_id": "cam_corr",
      "logical_path": "footage/sess_corr_b/sess_corr_b_v1.mp4",
      "source_sha256": "ccea5e36856befc97fbd8ac04790f8288e88d9e7e9c9d1b9ace508dfba55bffb",
      "duration_s": 420.0,
      "codec": "h264",
      "container": "mp4",
      "declared_fps": 25.0,
      "recording_start": null,
      "timebase": "1/25",
      "synthetic": true
    }
  ],
  "authorization": {
    "status": "authorized",
    "consent_recorded": true,
    "retention_policy": "delete-after-event",
    "notes": "SYNTHETIC placeholder session."
  },
  "provenance": {
    "collected_by": "member4-seed-generator",
    "collection_date": "2026-07-20",
    "staged_scenario_description": "synthetic staged scenario for scn_corr_b",
    "organizer_delivery_ref": null
  },
  "synthetic": true,
  "notes": "Deterministic synthetic manifest generated by data/tools/build_seed_dataset.py.",
  "created_at": "2026-07-20T09:00:00",
  "content_hash": "11a07eb2a5efa627313d44a48f7c1b6cd9bb71a540ebf106ad833ba5ed8db41c"
}
