{
  "manifest_schema_version": "1.0.0",
  "session_id": "sess_entrance",
  "scenario_id": "scn_entrance",
  "pool": "staged",
  "camera_ids": [
    "cam_ent"
  ],
  "footage_files": [
    {
      "file_id": "sess_entrance_v1",
      "camera_id": "cam_ent",
      "logical_path": "footage/sess_entrance/sess_entrance_v1.mp4",
      "source_sha256": "b07db8ebab8016128bf45175adb6a381b5f062d22e4407e591f45f82c4291af2",
      "duration_s": 600.0,
      "codec": "h264",
      "container": "mp4",
      "declared_fps": 25.0,
      "recording_start": null,
      "timebase": "1/25",
      "synthetic": true
    }
  ],
  "authorization": {
    "status": "authorized",
    "consent_recorded": true,
    "retention_policy": "delete-after-event",
    "notes": "SYNTHETIC placeholder session."
  },
  "provenance": {
    "collected_by": "member4-seed-generator",
    "collection_date": "2026-07-20",
    "staged_scenario_description": "synthetic staged scenario for scn_entrance",
    "organizer_delivery_ref": null
  },
  "synthetic": true,
  "notes": "Deterministic synthetic manifest generated by data/tools/build_seed_dataset.py.",
  "created_at": "2026-07-20T09:00:00",
  "content_hash": "eb36e717d7aab11ec864f192e2e3090fc1bdadc4c330de4b2a48dab2356e8b3d"
}
