{
  "manifest_schema_version": "1.0.0",
  "session_id": "sess_corr",
  "scenario_id": "scn_corr",
  "pool": "staged",
  "camera_ids": [
    "cam_corr"
  ],
  "footage_files": [
    {
      "file_id": "sess_corr_v1",
      "camera_id": "cam_corr",
      "logical_path": "footage/sess_corr/sess_corr_v1.mp4",
      "source_sha256": "a4789442ac24f7c522549e71ea608d9a4973fd7b0902b56feea0c98010d2c631",
      "duration_s": 420.0,
      "codec": "h264",
      "container": "mp4",
      "declared_fps": 25.0,
      "recording_start": null,
      "timebase": "1/25",
      "synthetic": true
    }
  ],
  "authorization": {
    "status": "authorized",
    "consent_recorded": true,
    "retention_policy": "delete-after-event",
    "notes": "SYNTHETIC placeholder session."
  },
  "provenance": {
    "collected_by": "member4-seed-generator",
    "collection_date": "2026-07-20",
    "staged_scenario_description": "synthetic staged scenario for scn_corr",
    "organizer_delivery_ref": null
  },
  "synthetic": true,
  "notes": "Deterministic synthetic manifest generated by data/tools/build_seed_dataset.py.",
  "created_at": "2026-07-20T09:00:00",
  "content_hash": "d64e9a10fe74d1cb4e37d2e3ffb6e4cccb50b3b85424d7c101a115a58a5590d0"
}
