{
  "manifest_schema_version": "1.0.0",
  "session_id": "sess_golden",
  "scenario_id": "scn_golden",
  "pool": "staged",
  "camera_ids": [
    "cam_gold"
  ],
  "footage_files": [
    {
      "file_id": "sess_golden_v1",
      "camera_id": "cam_gold",
      "logical_path": "footage/sess_golden/sess_golden_v1.mp4",
      "source_sha256": "12b3bbe88c9e80c027867db857298f1377b2aa14208dd0040f910b7d9323da35",
      "duration_s": 900.0,
      "codec": "h264",
      "container": "mp4",
      "declared_fps": 25.0,
      "recording_start": null,
      "timebase": "1/25",
      "synthetic": true
    }
  ],
  "authorization": {
    "status": "authorized",
    "consent_recorded": true,
    "retention_policy": "delete-after-event",
    "notes": "SYNTHETIC placeholder session."
  },
  "provenance": {
    "collected_by": "member4-seed-generator",
    "collection_date": "2026-07-20",
    "staged_scenario_description": "synthetic staged scenario for scn_golden",
    "organizer_delivery_ref": null
  },
  "synthetic": true,
  "notes": "Deterministic synthetic manifest generated by data/tools/build_seed_dataset.py.",
  "created_at": "2026-07-20T09:00:00",
  "content_hash": "9798058e4be028b6872e05697cb3c45e419db9f99de4e2f64204e9210637edf3"
}
