{
  "manifest_schema_version": "1.0.0",
  "session_id": "sess_cross_b",
  "scenario_id": "scn_cross_b",
  "pool": "staged",
  "camera_ids": [
    "cam_cross"
  ],
  "footage_files": [
    {
      "file_id": "sess_cross_b_v1",
      "camera_id": "cam_cross",
      "logical_path": "footage/sess_cross_b/sess_cross_b_v1.mp4",
      "source_sha256": "15faef31316cb4fc0909b00726c7878f2ba8813fad8106d65a90156eca97848c",
      "duration_s": 900.0,
      "codec": "h264",
      "container": "mp4",
      "declared_fps": 25.0,
      "recording_start": null,
      "timebase": "1/25",
      "synthetic": true
    }
  ],
  "authorization": {
    "status": "authorized",
    "consent_recorded": true,
    "retention_policy": "delete-after-event",
    "notes": "SYNTHETIC placeholder session."
  },
  "provenance": {
    "collected_by": "member4-seed-generator",
    "collection_date": "2026-07-20",
    "staged_scenario_description": "synthetic staged scenario for scn_cross_b",
    "organizer_delivery_ref": null
  },
  "synthetic": true,
  "notes": "Deterministic synthetic manifest generated by data/tools/build_seed_dataset.py.",
  "created_at": "2026-07-20T09:00:00",
  "content_hash": "0c0db3d96a0b136ab0be7ee601837899634e93e8ca83c2dc6ae11842267c2954"
}
